{"style": {"id": 8, "code": "21A", "name": "American IPA", "guide": "BJCP"}, "reason": "Picked 21A American IPA: the name matches (1.00).", "scores": {"name": 4.0, "total": 6.33, "words": 1.0, "numbers": 1.33}, "mismatch": null, "alt_styles": [], "candidates": [{"code": "21A", "guide": "BJCP", "score": 6.33}, {"code": "west-coast-style-india-pale-ale", "guide": "BA", "score": 5.62}, {"code": "21B", "guide": "BJCP", "score": 4.03}, {"code": "12C", "guide": "BJCP", "score": 3.99}, {"code": "21C", "guide": "BJCP", "score": 3.72}], "guide_reason": "no guide set or named in the request; both guides scored, best fit 21A", "unknown_reason": null}
